{
  "schema_version": 1,
  "skill": "goal-pipeline-unified-review",
  "gf_skill_attested": true,
  "result": "pass",
  "checklist_goal": [
    {
      "id": "C01",
      "passed": true,
      "detail": "ok"
    }
  ],
  "checklist_gf": [],
  "issues": [],
  "provider": "deterministic",
  "packet_hash": "c01d9ee55537e046",
  "invocation_count": 1
}